{
  "entities": [
    {
      "attributes": {
        "Name": "现浇混凝土梁-支撑梁:S_支撑梁-1-ZC1 435 C30 2:298794",
        "ObjectPlacement": {
          "axis": [
            0.0,
            0.0,
            1.0
          ],
          "origin": [
            5073.77532839348,
            -9034.19917868106,
            0.0
          ],
          "ref_direction": [
            1.0,
            0.0,
            0.0
          ],
          "relative_to": "ifc2x3:b6c435be955a:IfcBuildingStorey:1vTeahUkP60PdWqwCTjUuM"
        },
        "ObjectType": "现浇混凝土梁-支撑梁:S_支撑梁-1-ZC1 435 C30 2",
        "Representation": {
          "depth": 2086.0,
          "direction": [
            0.0,
            0.0,
            1.0
          ],
          "kind": "extruded_profile",
          "position": {
            "axis": [
              1.0,
              0.0,
              0.0
            ],
            "origin": [
              0.0,
              0.0,
              -285.0
            ],
            "ref_direction": [
              0.0,
              0.0,
              -1.0
            ]
          },
          "profile": {
            "kind": "polygon",
            "points": [
              [
                -285.0000000000005,
                -217.49999999999298
              ],
              [
                285.0000000000005,
                -217.49999999999298
              ],
              [
                285.0000000000005,
                217.500000000006
              ],
              [
                -285.0000000000005,
                217.500000000006
              ],
              [
                -285.0000000000005,
                -217.49999999999298
              ]
            ]
          }
        },
        "Tag": "298794"
      },
      "global_id": "17tPjyQtf2L9JnbXXmcT43",
      "id": "ifc2x3:b6c435be955a:IfcBeam:17tPjyQtf2L9JnbXXmcT43",
      "ifc_class": "IfcBeam",
      "property_sets": {
        "Pset_BeamCommon": {
          "IsExternal": false,
          "Reference": "S_支撑梁-1-ZC1 435 C30 2",
          "Slope": 0.0,
          "Span": 2086.0
        },
        "Pset_QuantityTakeOff": {
          "Reference": "S_支撑梁-1-ZC1 435 C30 2"
        },
        "Pset_ReinforcementBarPitchOfBeam": {
          "Reference": "S_支撑梁-1-ZC1 435 C30 2"
        }
      },
      "provenance": {
        "source_ref": "sha256:b6c435be955aeb6b2998f42a62f4ebf8c3f91eb7d373ca71a2dcedfeb95b3fdc#IfcBeam:17tPjyQtf2L9JnbXXmcT43",
        "source_sha256": "b6c435be955aeb6b2998f42a62f4ebf8c3f91eb7d373ca71a2dcedfeb95b3fdc"
      }
    },
    {
      "attributes": {
        "Name": "现浇混凝土梁-支撑梁:S_支撑梁-1-ZC1 400x570 C30 2:298003",
        "ObjectPlacement": {
          "axis": [
            0.0,
            0.0,
            1.0
          ],
          "origin": [
            -7452.22467160652,
            -14836.1991786811,
            0.0
          ],
          "ref_direction": [
            1.0,
            0.0,
            0.0
          ],
          "relative_to": "ifc2x3:b6c435be955a:IfcBuildingStorey:1vTeahUkP60PdWqwCTjUuM"
        },
        "ObjectType": "现浇混凝土梁-支撑梁:S_支撑梁-1-ZC1 400x570 C30 2",
        "Representation": {
          "depth": 3903.0,
          "direction": [
            0.0,
            0.0,
            1.0
          ],
          "kind": "extruded_profile",
          "position": {
            "axis": [
              1.0,
              0.0,
              0.0
            ],
            "origin": [
              0.0,
              0.0,
              -285.0
            ],
            "ref_direction": [
              0.0,
              0.0,
              -1.0
            ]
          },
          "profile": {
            "kind": "polygon",
            "points": [
              [
                -285.0000000000005,
                -199.999999999987
              ],
              [
                285.0000000000005,
                -199.999999999987
              ],
              [
                285.0000000000005,
                200.000000000013
              ],
              [
                -285.0000000000005,
                200.000000000013
              ],
              [
                -285.0000000000005,
                -199.999999999987
              ]
            ]
          }
        },
        "Tag": "298003"
      },
      "global_id": "17tPjyQtf2L9JnbXXmcT8w",
      "id": "ifc2x3:b6c435be955a:IfcBeam:17tPjyQtf2L9JnbXXmcT8w",
      "ifc_class": "IfcBeam",
      "property_sets": {
        "Pset_BeamCommon": {
          "IsExternal": false,
          "Reference": "S_支撑梁-1-ZC1 400x570 C30 2",
          "Slope": 0.0,
          "Span": 3903.0
        },
        "Pset_QuantityTakeOff": {
          "Reference": "S_支撑梁-1-ZC1 400x570 C30 2"
        },
        "Pset_ReinforcementBarPitchOfBeam": {
          "Reference": "S_支撑梁-1-ZC1 400x570 C30 2"
        }
      },
      "provenance": {
        "source_ref": "sha256:b6c435be955aeb6b2998f42a62f4ebf8c3f91eb7d373ca71a2dcedfeb95b3fdc#IfcBeam:17tPjyQtf2L9JnbXXmcT8w",
        "source_sha256": "b6c435be955aeb6b2998f42a62f4ebf8c3f91eb7d373ca71a2dcedfeb95b3fdc"
      }
    },
    {
      "attributes": {
        "Name": "现浇混凝土梁-支撑梁:S_支撑梁-1-ZC1 400x570 C30 2:298104",
        "ObjectPlacement": {
          "axis": [
            0.0,
            0.0,
            1.0
          ],
          "origin": [
            -11753.2246716065,
            -14841.1991786811,
            0.0
          ],
          "ref_direction": [
            1.0,
            0.0,
            0.0
          ],
          "relative_to": "ifc2x3:b6c435be955a:IfcBuildingStorey:1vTeahUkP60PdWqwCTjUuM"
        },
        "ObjectType": "现浇混凝土梁-支撑梁:S_支撑梁-1-ZC1 400x570 C30 2",
        "Representation": {
          "depth": 3800.0,
          "direction": [
            0.0,
            0.0,
            1.0
          ],
          "kind": "extruded_profile",
          "position": {
            "axis": [
              1.0,
              0.0,
              0.0
            ],
            "origin": [
              0.0,
              0.0,
              -285.0
            ],
            "ref_direction": [
              0.0,
              0.0,
              -1.0
            ]
          },
          "profile": {
            "kind": "polygon",
            "points": [
              [
                -285.0000000000005,
                -199.999999999987
              ],
              [
                285.0000000000005,
                -199.999999999987
              ],
              [
                285.0000000000005,
                200.000000000013
              ],
              [
                -285.0000000000005,
                200.000000000013
              ],
              [
                -285.0000000000005,
                -199.999999999987
              ]
            ]
          }
        },
        "Tag": "298104"
      },
      "global_id": "17tPjyQtf2L9JnbXXmcT9H",
      "id": "ifc2x3:b6c435be955a:IfcBeam:17tPjyQtf2L9JnbXXmcT9H",
      "ifc_class": "IfcBeam",
      "property_sets": {
        "Pset_BeamCommon": {
          "IsExternal": false,
          "Reference": "S_支撑梁-1-ZC1 400x570 C30 2",
          "Slope": 0.0,
          "Span": 3800.0
        },
        "Pset_QuantityTakeOff": {
          "Reference": "S_支撑梁-1-ZC1 400x570 C30 2"
        },
        "Pset_ReinforcementBarPitchOfBeam": {
          "Reference": "S_支撑梁-1-ZC1 400x570 C30 2"
        }
      },
      "provenance": {
        "source_ref": "sha256:b6c435be955aeb6b2998f42a62f4ebf8c3f91eb7d373ca71a2dcedfeb95b3fdc#IfcBeam:17tPjyQtf2L9JnbXXmcT9H",
        "source_sha256": "b6c435be955aeb6b2998f42a62f4ebf8c3f91eb7d373ca71a2dcedfeb95b3fdc"
      }
    },
    {
      "attributes": {
        "Name": "现浇混凝土梁-支撑梁:S_支撑梁-1-ZC1 435 C30 2:298326",
        "ObjectPlacement": {
          "axis": [
            0.0,
            0.0,
            1.0
          ],
          "origin": [
            4822.77532839348,
            -7021.19917868106,
            0.0
          ],
          "ref_direction": [
            0.0,
            -1.0,
            0.0
          ],
          "relative_to": "ifc2x3:b6c435be955a:IfcBuildingStorey:1vTeahUkP60PdWqwCTjUuM"
        },
        "ObjectType": "现浇混凝土梁-支撑梁:S_支撑梁-1-ZC1 435 C30 2",
        "Representation": {
          "depth": 1760.0,
          "direction": [
            0.0,
            0.0,
            1.0
          ],
          "kind": "extruded_profile",
          "position": {
            "axis": [
              1.0,
              0.0,
              0.0
            ],
            "origin": [
              0.0,
              0.0,
              -285.0
            ],
            "ref_direction": [
              0.0,
              0.0,
              -1.0
            ]
          },
          "profile": {
            "kind": "rectangle",
            "x": 570.000000000001,
            "y": 434.999999999999
          }
        },
        "Tag": "298326"
      },
      "global_id": "17tPjyQtf2L9JnbXXmcTD$",
      "id": "ifc2x3:b6c435be955a:IfcBeam:17tPjyQtf2L9JnbXXmcTD$",
      "ifc_class": "IfcBeam",
      "property_sets": {
        "Pset_BeamCommon": {
          "IsExternal": false,
          "Reference": "S_支撑梁-1-ZC1 435 C30 2",
          "Slope": 0.0,
          "Span": 1760.0
        },
        "Pset_QuantityTakeOff": {
          "Reference": "S_支撑梁-1-ZC1 435 C30 2"
        },
        "Pset_ReinforcementBarPitchOfBeam": {
          "Reference": "S_支撑梁-1-ZC1 435 C30 2"
        }
      },
      "provenance": {
        "source_ref": "sha256:b6c435be955aeb6b2998f42a62f4ebf8c3f91eb7d373ca71a2dcedfeb95b3fdc#IfcBeam:17tPjyQtf2L9JnbXXmcTD$",
        "source_sha256": "b6c435be955aeb6b2998f42a62f4ebf8c3f91eb7d373ca71a2dcedfeb95b3fdc"
      }
    },
    {
      "attributes": {
        "Name": "现浇混凝土梁-支撑梁:S_支撑梁-1-ZC1 700x800 C30:297744",
        "ObjectPlacement": {
          "axis": [
            0.0,
            0.0,
            1.0
          ],
          "origin": [
            -3309.22467160652,
            -9309.19917868106,
            0.0
          ],